<jqassistant-rules xmlns="http://schema.jqassistant.org/rule/v1.10"
                   xmlns:xsi="http://www.w3.org/2001/XMLSchema-instance"
                   xsi:schemaLocation="http://schema.jqassistant.org/rule/v1.10 http://schema.jqassistant.org/rule/jqassistant-rule-v1.10.xsd">

<group id="junit:Default">
        <includeConstraint refId="junit:IgnoreWithoutMessage"/>
    </group>

    <concept id="junit:TestCaseDefinedByClass">
        <description>Creates a relation DEFINED_BY between all test cases from test reports and the class which defined it.</description>
        <cypher><![CDATA[
            MATCH
              (testcase:TestCase)
            WITH
              testcase
            MATCH
              (testclass:Type)
            WHERE
              testclass.fqn = testcase.className
            MERGE
              (testcase)-[:DEFINED_BY]->(testclass)
            RETURN
              testcase.name AS TestCase, testclass AS TestClass
    ]]></cypher>
    </concept>

    <concept id="junit:TestCaseImplementedByMethod">
        <requiresConcept refId="junit:TestCaseDefinedByClass" />
        <description>Creates a relation IMPLEMENTED_BY between all test cases from test reports and their implementing
            methods.
        </description>
        <cypher><![CDATA[
            MATCH
              (testcase:TestCase)-[:DEFINED_BY]->(testclass:Type),
              (testclass)-[:EXTENDS*0..]->(:Type)-[:DECLARES]->(testmethod:Method)
            WHERE
              testmethod.name = testcase.name
            MERGE
              (testcase)-[:IMPLEMENTED_BY]->(testmethod)
            RETURN
              testcase.name AS TestCase, testmethod as TestMethod
    ]]></cypher>
    </concept>

    <concept id="junit:Inactive">
        <description>Abstract concept returning all elements labeled with :JUnit:Inactive and the according reason.</description>
        <cypher><![CDATA[
            MATCH
              (t:Type)-[:DECLARES*0..1]->(e:JUnit:Inactive)
            RETURN
               t AS DeclaringType, e AS Element, e.inactiveReason AS Reason
    ]]></cypher>
    </concept>

    <concept id="junit:Disabled">
        <providesConcept refId="junit:Inactive" />
        <description>Concept labeling all @Disabled-annotated elements with :JUnit:Inactive and setting the according reason.</description>
        <cypher><![CDATA[
            MATCH
              (t:Type)-[:DECLARES*0..1]->(e),
              (e)-[:ANNOTATED_BY]->(disabled:Annotation)-[:OF_TYPE]->(ignoreType:Type {fqn: "org.junit.jupiter.api.Disabled"})
            OPTIONAL MATCH
              (disabled)-[:HAS]->(value:Value {name:"value"})
            SET
              e:JUnit:Inactive,
              e.inactiveReason = value.value
            RETURN
              t AS DeclaringType, e AS Element, e.inactiveReason AS Reason
    ]]></cypher>
    </concept>

    <concept id="junit:Ignore">
        <providesConcept refId="junit:Inactive" />
        <description>Concept labeling all @Ignore-annotated elements with :JUnit:Inactive and setting the according reason.</description>
        <cypher><![CDATA[
            MATCH
              (t:Type)-[:DECLARES*0..1]->(e),
              (e)-[:ANNOTATED_BY]->(disabled:Annotation)-[:OF_TYPE]->(ignoreType:Type {fqn: "org.junit.Ignore"})
            OPTIONAL MATCH
              (disabled)-[:HAS]->(value:Value {name:"value"})
            SET
              e:JUnit:Inactive,
              e.inactiveReason = value.value
            RETURN
              t AS DeclaringType, e AS Element, e.inactiveReason AS Reason
    ]]></cypher>
    </concept>

    <constraint id="junit:IgnoreWithoutMessage">
        <requiresConcept refId="junit:Inactive" />
        <description>Inactive tests must be provided with an according reason.</description>
        <cypher><![CDATA[
            MATCH
              (t:Type)-[:DECLARES*0..1]->(e:Inactive)
            WHERE
              e.inactiveReason IS NULL
            RETURN
              t AS DeclaringClass, e AS IgnoreWithoutMessage
        ]]></cypher>
        <report primaryColumn="IgnoreWithoutMessage"/>
    </constraint>
</jqassistant-rules>
